{
  "schema_version": "AGL_LITE_V1_2_1",
  "project_id": "AGL-LITE-EXAMPLE",
  "policy_version": "policy-v1.2.1",
  "created_at_utc": "2026-10-27T00:00:00Z",
  "delivery_id": "DL-001",
  "artifact_id": "ART-001",
  "target": "GIT",
  "status": "PENDING",
  "operation_id": "OP-003",
  "source_hash": "aaaaaaaaaaaaaaaaaaaaaaaaaaaaaaaaaaaaaaaaaaaaaaaaaaaaaaaaaaaaaaaa",
  "destination_ref": "git/artifact/ART-001",
  "readback_hash": null,
  "evidence_ref": "evidence/DL-001.json"
}
